[
  {
    "schema_version": "1.0.0",
    "record_id": "boundary-01",
    "note_id": "boundary-01",
    "note_timestamp_us": 1000000,
    "clock_domain": "song_time",
    "technique": "tone",
    "target_id": "tone-1",
    "judgement": "miss"
  },
  {
    "schema_version": "1.0.0",
    "record_id": "boundary-02",
    "note_id": "boundary-02",
    "note_timestamp_us": 1000000,
    "clock_domain": "song_time",
    "technique": "ding",
    "target_id": "ding",
    "judgement": "good",
    "input_event_id": "boundary-02:input",
    "input_timestamp_us": 900000,
    "delta_us": -100000
  },
  {
    "schema_version": "1.0.0",
    "record_id": "boundary-03",
    "note_id": "boundary-03",
    "note_timestamp_us": 1000000,
    "clock_domain": "song_time",
    "technique": "slap",
    "target_id": "outer-hit-radius",
    "judgement": "good",
    "input_event_id": "boundary-03:input",
    "input_timestamp_us": 939999,
    "delta_us": -60001
  },
  {
    "schema_version": "1.0.0",
    "record_id": "boundary-04",
    "note_id": "boundary-04",
    "note_timestamp_us": 1000000,
    "clock_domain": "song_time",
    "technique": "tone",
    "target_id": "tone-1",
    "judgement": "great",
    "input_event_id": "boundary-04:input",
    "input_timestamp_us": 940000,
    "delta_us": -60000
  },
  {
    "schema_version": "1.0.0",
    "record_id": "boundary-05",
    "note_id": "boundary-05",
    "note_timestamp_us": 1000000,
    "clock_domain": "song_time",
    "technique": "ding",
    "target_id": "ding",
    "judgement": "great",
    "input_event_id": "boundary-05:input",
    "input_timestamp_us": 969999,
    "delta_us": -30001
  },
  {
    "schema_version": "1.0.0",
    "record_id": "boundary-06",
    "note_id": "boundary-06",
    "note_timestamp_us": 1000000,
    "clock_domain": "song_time",
    "technique": "slap",
    "target_id": "outer-hit-radius",
    "judgement": "perfect",
    "input_event_id": "boundary-06:input",
    "input_timestamp_us": 970000,
    "delta_us": -30000
  },
  {
    "schema_version": "1.0.0",
    "record_id": "boundary-07",
    "note_id": "boundary-07",
    "note_timestamp_us": 1000000,
    "clock_domain": "song_time",
    "technique": "tone",
    "target_id": "tone-1",
    "judgement": "perfect",
    "input_event_id": "boundary-07:input",
    "input_timestamp_us": 1000000,
    "delta_us": 0
  },
  {
    "schema_version": "1.0.0",
    "record_id": "boundary-08",
    "note_id": "boundary-08",
    "note_timestamp_us": 1000000,
    "clock_domain": "song_time",
    "technique": "ding",
    "target_id": "ding",
    "judgement": "perfect",
    "input_event_id": "boundary-08:input",
    "input_timestamp_us": 1030000,
    "delta_us": 30000
  },
  {
    "schema_version": "1.0.0",
    "record_id": "boundary-09",
    "note_id": "boundary-09",
    "note_timestamp_us": 1000000,
    "clock_domain": "song_time",
    "technique": "slap",
    "target_id": "outer-hit-radius",
    "judgement": "great",
    "input_event_id": "boundary-09:input",
    "input_timestamp_us": 1030001,
    "delta_us": 30001
  },
  {
    "schema_version": "1.0.0",
    "record_id": "boundary-10",
    "note_id": "boundary-10",
    "note_timestamp_us": 1000000,
    "clock_domain": "song_time",
    "technique": "tone",
    "target_id": "tone-1",
    "judgement": "great",
    "input_event_id": "boundary-10:input",
    "input_timestamp_us": 1060000,
    "delta_us": 60000
  },
  {
    "schema_version": "1.0.0",
    "record_id": "boundary-11",
    "note_id": "boundary-11",
    "note_timestamp_us": 1000000,
    "clock_domain": "song_time",
    "technique": "ding",
    "target_id": "ding",
    "judgement": "good",
    "input_event_id": "boundary-11:input",
    "input_timestamp_us": 1060001,
    "delta_us": 60001
  },
  {
    "schema_version": "1.0.0",
    "record_id": "boundary-12",
    "note_id": "boundary-12",
    "note_timestamp_us": 1000000,
    "clock_domain": "song_time",
    "technique": "slap",
    "target_id": "outer-hit-radius",
    "judgement": "good",
    "input_event_id": "boundary-12:input",
    "input_timestamp_us": 1100000,
    "delta_us": 100000
  },
  {
    "schema_version": "1.0.0",
    "record_id": "boundary-13",
    "note_id": "boundary-13",
    "note_timestamp_us": 1000000,
    "clock_domain": "song_time",
    "technique": "tone",
    "target_id": "tone-1",
    "judgement": "miss"
  },
  {
    "schema_version": "1.0.0",
    "record_id": "no-input-miss",
    "note_id": "no-input-miss",
    "note_timestamp_us": 1000000,
    "clock_domain": "song_time",
    "technique": "tone",
    "target_id": "tone-1",
    "judgement": "miss"
  }
]
